{
  "$schema": "https://tdk-landscape.github.io/schema.app.json",
  "name": "@docker/nginx-flask-mysql",
  "schemaVersion": 1,
  "description": "Docker sample: nginx-flask-mysql. Multi-service example from docker/awesome-compose.",
  "repository": "https://github.com/docker/awesome-compose/tree/master/nginx-flask-mysql",
  "license": "CC0-1.0",
  "sourceCommit": "30f4b7f6a6c3b0c0ecf4d4efb0de203c48d11562"
}
