{
  "$schema": "https://tdk-landscape.github.io/schema.app.json",
  "name": "@getarcaneapp/arcane",
  "schemaVersion": 1,
  "description": "Modern Docker Management, Designed for Everyone",
  "repository": "https://github.com/getarcaneapp/arcane",
  "license": "BSD-3-Clause",
  "sourceCommit": "ac2e0201ea1666e083c86f6ec7dd66c4a664bfee"
}
